{
  "$schema": "https://json-schema.org/draft/2020-12/schema",
  "$id": "https://github.com/jusso-dev/foiled/schemas/public-exploit-page.schema.json",
  "title": "Foiled public exploit page",
  "description": "The public snapshot of a published write-up (#35), returned by GET /v0/public/exploited/{slug}. Built from an allow-list of fields: no tenant, author, reviewer, attempt, campaign, sensor or IOC ids, no raw IOC values, and no HTML. The body is a tree of blocks and inlines rendered as text. IOCs are defanged and appear only after their release time. Mirrored by foiled_core::writeup::PublicPage. See docs/research-writeups.md#public-exploit-pages.",
  "type": "object",
  "additionalProperties": false,
  "required": ["slug", "canonical_path", "title", "summary", "body", "tlp", "published_at", "visible_from", "version", "cves", "techniques", "timeline", "redacted_payload", "iocs"],
  "properties": {
    "slug": { "type": "string", "pattern": "^[a-z0-9]+(-[a-z0-9]+)*$", "maxLength": 80 },
    "canonical_path": { "type": "string", "pattern": "^/exploited/[a-z0-9]+(-[a-z0-9]+)*$" },
    "title": { "type": "string", "minLength": 1 },
    "summary": { "type": "string" },
    "body": { "type": "array", "items": { "$ref": "#/$defs/block" } },
    "tlp": { "const": "clear" },
    "published_at": { "type": "integer" },
    "visible_from": { "type": "integer" },
    "version": { "type": "integer", "minimum": 1 },
    "cves": { "type": "array", "items": { "$ref": "#/$defs/assessment" } },
    "techniques": { "type": "array", "items": { "$ref": "#/$defs/assessment" } },
    "timeline": {
      "type": "array",
      "items": {
        "type": "object",
        "additionalProperties": false,
        "required": ["at", "kind", "label"],
        "properties": {
          "at": { "type": "integer" },
          "kind": { "enum": ["first_seen", "advisory_published", "confirmed", "published"] },
          "label": { "type": "string", "minLength": 1 }
        }
      }
    },
    "redacted_payload": { "description": "Plain text, secrets masked. Escape before rendering.", "type": ["string", "null"], "maxLength": 2000 },
    "iocs": {
      "type": "array",
      "items": {
        "type": "object",
        "additionalProperties": false,
        "required": ["type", "display", "first_seen_day", "release_at", "tlp"],
        "properties": {
          "type": { "type": "string", "minLength": 1 },
          "display": { "description": "Defanged. Never parse it.", "type": "string", "minLength": 1 },
          "first_seen_day": { "type": "integer" },
          "release_at": { "type": "integer" },
          "tlp": { "const": "clear" }
        }
      }
    }
  },
  "$defs": {
    "assessment": {
      "type": "object",
      "additionalProperties": false,
      "required": ["id", "wording", "confirmed_at", "advisory_published_at"],
      "properties": {
        "id": { "type": "string", "minLength": 1 },
        "wording": { "enum": ["we assess as", "confirmed"] },
        "confirmed_at": { "type": ["integer", "null"] },
        "advisory_published_at": { "type": ["integer", "null"] }
      }
    },
    "inlines": {
      "type": "array",
      "items": {
        "oneOf": [
          {
            "type": "object",
            "additionalProperties": false,
            "required": ["type", "text"],
            "properties": {
              "type": { "enum": ["text", "strong", "emphasis", "code"] },
              "text": { "type": "string" }
            }
          },
          {
            "type": "object",
            "additionalProperties": false,
            "required": ["type", "text", "href"],
            "properties": {
              "type": { "const": "link" },
              "text": { "type": "string" },
              "href": { "description": "https:// or a site-relative path.", "type": "string", "pattern": "^(https://|/[^/])" }
            }
          }
        ]
      }
    },
    "block": {
      "oneOf": [
        {
          "type": "object",
          "additionalProperties": false,
          "required": ["type", "level", "inlines"],
          "properties": {
            "type": { "const": "heading" },
            "level": { "type": "integer", "minimum": 2, "maximum": 4 },
            "inlines": { "$ref": "#/$defs/inlines" }
          }
        },
        {
          "type": "object",
          "additionalProperties": false,
          "required": ["type", "inlines"],
          "properties": {
            "type": { "enum": ["paragraph", "quote"] },
            "inlines": { "$ref": "#/$defs/inlines" }
          }
        },
        {
          "type": "object",
          "additionalProperties": false,
          "required": ["type", "ordered", "items"],
          "properties": {
            "type": { "const": "list" },
            "ordered": { "type": "boolean" },
            "items": { "type": "array", "items": { "$ref": "#/$defs/inlines" } }
          }
        },
        {
          "type": "object",
          "additionalProperties": false,
          "required": ["type", "text"],
          "properties": {
            "type": { "const": "code" },
            "text": { "type": "string" }
          }
        },
        {
          "type": "object",
          "additionalProperties": false,
          "required": ["type"],
          "properties": { "type": { "const": "rule" } }
        }
      ]
    }
  }
}
