{
  "slug": "demo-app-upload-traversal",
  "canonical_path": "/exploited/demo-app-upload-traversal",
  "title": "Upload path traversal attempts against Demo App",
  "summary": "We assess as attempts against FOILED-DEMO-0001 from several sources, first seen on Foiled sensors before the advisory.",
  "body": [
    {
      "type": "heading",
      "level": 3,
      "inlines": [
        {
          "type": "text",
          "text": "What we saw"
        }
      ]
    },
    {
      "type": "paragraph",
      "inlines": [
        {
          "type": "text",
          "text": "We assess as attempts against FOILED-DEMO-0001: uploads that climb out of the upload directory with "
        },
        {
          "type": "code",
          "text": "../"
        },
        {
          "type": "text",
          "text": " segments."
        }
      ]
    },
    {
      "type": "heading",
      "level": 3,
      "inlines": [
        {
          "type": "text",
          "text": "Behaviour"
        }
      ]
    },
    {
      "type": "list",
      "ordered": true,
      "items": [
        [
          {
            "type": "text",
            "text": "A probe of "
          },
          {
            "type": "code",
            "text": "/api/upload"
          },
          {
            "type": "text",
            "text": "."
          }
        ],
        [
          {
            "type": "text",
            "text": "An upload with a traversal path."
          }
        ],
        [
          {
            "type": "text",
            "text": "A request for the dropped file."
          }
        ]
      ]
    },
    {
      "type": "paragraph",
      "inlines": [
        {
          "type": "text",
          "text": "Sources included 203.0.113.21 and 198[.]51[.]100[.]40, which are documentation addresses in this example."
        }
      ]
    },
    {
      "type": "heading",
      "level": 3,
      "inlines": [
        {
          "type": "text",
          "text": "Sources"
        }
      ]
    },
    {
      "type": "list",
      "ordered": false,
      "items": [
        [
          {
            "type": "link",
            "text": "Advisory",
            "href": "https://advisories.example.invalid/FOILED-DEMO-0001"
          }
        ],
        [
          {
            "type": "link",
            "text": "Exploited list",
            "href": "/exploited"
          }
        ]
      ]
    }
  ],
  "tlp": "clear",
  "published_at": 1792200000000,
  "visible_from": 1792200000000,
  "version": 4,
  "cves": [
    {
      "id": "FOILED-DEMO-0001",
      "wording": "we assess as",
      "confirmed_at": null,
      "advisory_published_at": 1792022400000
    }
  ],
  "techniques": [
    {
      "id": "T1190",
      "wording": "we assess as",
      "confirmed_at": null,
      "advisory_published_at": null
    }
  ],
  "timeline": [
    {
      "at": 1791936000000,
      "kind": "first_seen",
      "label": "First seen on Foiled sensors"
    },
    {
      "at": 1792022400000,
      "kind": "advisory_published",
      "label": "Advisory published for FOILED-DEMO-0001"
    },
    {
      "at": 1792200000000,
      "kind": "published",
      "label": "Published"
    }
  ],
  "redacted_payload": "POST /api/upload?path=../../tmp/.w HTTP/1.1\nAuthorization: REDACTED",
  "iocs": []
}
